{
  "id": "22810c4a-a5f3-483e-8daa-5bb746ffb548",
  "slug": "mux_nova",
  "identity": {
    "label": "MUX-NOVA (Bonsai Dojo)",
    "description": "Auxiliary Ollama host on the nim-substation-bonsai workstation, reachable over Tailscale. Owned hardware sitting idle most of the day - the low-cost dispatch target. A rogue syndicate: the model emits tool calls and the agency harness executes them (read-only filesystem functions, confined to the mission working directory). No shell, no writes.",
    "vendor": "self",
    "tags": [
      "auxiliary",
      "amortized",
      "tailnet",
      "dojo",
      "harness:agency"
    ]
  },
  "transport_slug": "ollama_chat",
  "endpoint": {
    "base_uri": "https://mux-nova.tailef068f.ts.net",
    "credential_id": null,
    "substation_id": "b6f45dad-a8d5-421c-a7ab-98d3e33b63b2",
    "egress": "private",
    "verify_tls": true
  },
  "channels": [
    {
      "slug": "qwen3_coder",
      "label": "Qwen3 Coder 30B",
      "model": "qwen3-coder:30b",
      "default": true,
      "capabilities": [
        "text_generation",
        "system_prompt",
        "structured_output",
        "tool_use",
        "filesystem_read"
      ],
      "limits": {
        "context_window": 32768,
        "max_concurrent": 1,
        "timeout_seconds": 600
      },
      "parameters": {
        "temperature": 0.2
      },
      "cost": {
        "class": "amortized",
        "currency": "USD"
      },
      "notes": "30.5B MoE, Q4_K_M. Measured ~64 tok/s eval warm; first call after idle pays a model-load penalty of roughly 10s. max_concurrent is 1 deliberately - one workstation GPU is not a fleet, and parallel requests queue behind each other anyway. Context: 32768 tokens served (context_length from /api/ps, verified 2026-10-14). The model advertises 262144, but 18 GB of weights plus a 256k q8_0 KV cache exceeds 32 GB of unified memory; ~131072 is the hardware ceiling.",
      "harness_profile": "readonly_fs_compact"
    }
  ],
  "status": {
    "state": "online",
    "last_check": "2026-10-14T19:03:52.901500+00:00",
    "error_message": "",
    "latency_ms": 1022.3,
    "models_reported": [
      "qwen3-coder:30b"
    ],
    "conformance": {
      "qwen3_coder": {
        "suite": "kat-1",
        "mode": "harness",
        "runs": 2,
        "passed": 10,
        "total": 12,
        "rate": 0.833,
        "at": "2026-10-14T17:42:01.573923+00:00"
      }
    }
  },
  "enabled": true,
  "audit": {
    "created_at": "2026-09-08T00:00:00+00:00",
    "updated_at": "2026-10-14T19:03:52.902518+00:00",
    "retired_at": null
  }
}